{
  "_readme": "This contract holds the Cline hub WebSocket values that Go and TypeScript both read. The daemon runs through `CLINE_RUN_AS_HUB_DAEMON=1 cline` and uses protocol v1. The worker stores native transcript rows in Cline's event envelope. The browser reads the same event and payload fields.\n\nThe native tables have these roles:\n- `eventFields` identifies the event and payload fields.\n- `events` holds events that reach a transcript or the control channel. Worker-only events stay in `providers/cline/protocol.go`.\n- `tools` holds the tool names that both sides read. The worker opens a child for `spawn_agent` and answers the `ask_question` executor. It rebuilds Act mode after `switch_to_act_mode` and streams `run_commands` output. The browser draws each tool.\n- `toolPrefixes` identifies configured agents from `.cline/agents/` through `subagent_<name>_<hash>`. The worker opens their children as it does for `spawn_agent`. The browser draws a subagent and warns on its approval.\n- `capabilities` identifies the question capability in a native control request.\n- `runReasons` holds the final run reason. The worker selects a completion, and the browser draws the turn-end divider.\n- `noticeKinds` and `noticePhases` hold the metadata kind and phase of `session.notice`. The worker folds retries and stores compaction ends. Compaction starts use live state. `max_tokens_compaction` explains recovery from the output limit. The worker routes notices to their owning transcript. The owner can be the lead or a spawned child. It can also be a teammate.\n- `teamRunEvents` holds the last event type of `team.progress`. The worker maintains the registry, and the browser draws run progress.\n- `approvalReply` and `capabilityReply` hold the native reply fields. The worker stores the browser's answer and sends it. The browser reads the stored answer for display.\n\nCline owns those values except `approvalReply.PermissionMode`. LeapMux owns these values:\n- `permissionModes`: `plan` and `act` use Cline's native session modes and approval policy. `auto_approve` uses Act mode and accepts every tool approval immediately.\n- `questionAnswer`: the browser's answer field for a question.\n- `declineReasons`: the native refusal reason when the user supplies no text. The browser draws a plain refusal.\n- `approvalReply.PermissionMode`: the mode that an approved plan selects. The worker removes this field before it sends the reply to Cline.",
  "_unread": {
    "approvalReply": {
      "ApprovalId": {
        "sides": [
          "ts"
        ],
        "why": "the browser reads a saved answer next to the request that it answers, which the worker keys by the approval id, so the words of the answer never need the id; the worker writes the id, because Cline's approval.respond takes it"
      }
    },
    "capabilityReply": {
      "RequestId": {
        "sides": [
          "ts"
        ],
        "why": "the browser reads a saved answer next to the question that it answers, which the worker keys by the request id, so the words of the answer never need the id; the worker writes the id, because Cline's capability.respond takes it"
      }
    }
  },
  "eventFields": {
    "Event": "event",
    "Payload": "payload"
  },
  "events": {
    "AssistantFinished": "assistant.finished",
    "AssistantMedia": "assistant.media",
    "ReasoningFinished": "reasoning.finished",
    "ToolStarted": "tool.started",
    "ToolFinished": "tool.finished",
    "RunCompleted": "run.completed",
    "RunFailed": "run.failed",
    "RunAborted": "run.aborted",
    "SessionNotice": "session.notice",
    "TeamProgress": "team.progress",
    "ApprovalRequested": "approval.requested",
    "CapabilityRequested": "capability.requested"
  },
  "tools": {
    "RunCommands": "run_commands",
    "SpawnAgent": "spawn_agent",
    "AskQuestion": "ask_question",
    "SwitchToActMode": "switch_to_act_mode"
  },
  "toolPrefixes": {
    "ConfiguredAgent": "subagent_"
  },
  "capabilities": {
    "AskQuestion": "tool_executor.askQuestion"
  },
  "runReasons": {
    "Completed": "completed",
    "MaxIterations": "max_iterations",
    "Aborted": "aborted",
    "MistakeLimit": "mistake_limit",
    "Error": "error"
  },
  "noticeKinds": {
    "AutoCompaction": "auto_compaction",
    "ManualCompaction": "manual_compaction",
    "OverflowRecoveryCompaction": "overflow_recovery_compaction",
    "CompactionBudgetEmergency": "compaction_budget_emergency",
    "ContextOverflowRecovery": "context_overflow_recovery",
    "ProviderErrorRetry": "provider_error_retry",
    "MaxTokensRecovery": "max_tokens_recovery",
    "MaxTokensCompaction": "max_tokens_compaction"
  },
  "noticePhases": {
    "Started": "started",
    "Completed": "completed",
    "Skipped": "skipped",
    "Failed": "failed"
  },
  "teamRunEvents": {
    "RunQueued": "run_queued",
    "RunStarted": "run_started",
    "RunCompleted": "run_completed",
    "RunFailed": "run_failed",
    "RunCancelled": "run_cancelled",
    "RunInterrupted": "run_interrupted"
  },
  "permissionModes": {
    "Plan": "plan",
    "Act": "act",
    "AutoApprove": "auto_approve"
  },
  "questionAnswer": {
    "Answer": "answer"
  },
  "declineReasons": {
    "Tool": "The user declined this tool call.",
    "Question": "The user declined to answer the question."
  },
  "approvalReply": {
    "ApprovalId": "approvalId",
    "Approved": "approved",
    "Reason": "reason",
    "PermissionMode": "permissionMode"
  },
  "capabilityReply": {
    "RequestId": "requestId",
    "Ok": "ok",
    "Payload": "payload",
    "Result": "result",
    "Error": "error"
  },
  "structs": {
    "ClineApprovalReply": {
      "doc": "The answer to one tool approval, as the worker stores it and as Cline's approval.respond takes it. Reason is the user's refusal text, which reaches the model as the tool's error. PermissionMode is LeapMux's own: it states the mode that an approved plan switches to, and the worker strips it before it sends the reply.",
      "table": "approvalReply",
      "fields": [
        {
          "key": "ApprovalId",
          "type": "string"
        },
        {
          "key": "Approved",
          "type": "bool"
        },
        {
          "key": "Reason",
          "type": "string",
          "omitempty": true
        },
        {
          "key": "PermissionMode",
          "type": "string",
          "omitempty": true
        }
      ]
    },
    "ClineCapabilityReply": {
      "doc": "The answer to one capability request, as the worker stores it and as Cline's capability.respond takes it. A question's answer is the `result` field of Payload; a refusal is Ok false with Error and no Payload.",
      "table": "capabilityReply",
      "fields": [
        {
          "key": "RequestId",
          "type": "string"
        },
        {
          "key": "Ok",
          "type": "bool"
        },
        {
          "key": "Payload",
          "type": "json.RawMessage",
          "omitempty": true
        },
        {
          "key": "Error",
          "type": "string",
          "omitempty": true
        }
      ]
    }
  }
}
